<?xml version="1.0" encoding="ISO-8859-1" standalone="yes"?>
<TrafficMatrixFile xsi:noNamespaceSchemaLocation="http://totem.run.montefiore.ulg.ac.be/Schema/TrafficMatrix-v1_1.xsd" xmlns:xsi="http://www.w3.org/2001/XMLSchema-instance">
    <IntraTM ASID="10003">
        <src id="0">
            <dst id="0">0.0</dst>
            <dst id="1">12.0</dst>
            <dst id="2">13.0</dst>
            <dst id="3">0.0</dst>
            <dst id="4">0.0</dst>
        </src>
        <src id="1">
            <dst id="0">16.0</dst>
            <dst id="1">0.0</dst>
            <dst id="2">0.0</dst>
            <dst id="3">0.0</dst>
            <dst id="4">0.0</dst>
        </src>
        <src id="2">
            <dst id="0">19.0</dst>
            <dst id="1">0.0</dst>
            <dst id="2">0.0</dst>
            <dst id="3">0.0</dst>
            <dst id="4">0.0</dst>
        </src>
        <src id="3">
            <dst id="0">0.0</dst>
            <dst id="1">0.0</dst>
            <dst id="2">0.0</dst>
            <dst id="3">0.0</dst>
            <dst id="4">0.0</dst>
        </src>
        <src id="4">
            <dst id="0">0.0</dst>
            <dst id="1">0.0</dst>
            <dst id="2">0.0</dst>
            <dst id="3">0.0</dst>
            <dst id="4">0.0</dst>
        </src>
    </IntraTM>
</TrafficMatrixFile>

